{
  "schemaVersion": 2,
  "kbVersion": "3.17.0",
  "updatedAt": "2026-08-28T23:55:55Z",
  "topicsAsset": "assets/data/v2/topics.json",
  "booksAsset": "assets/data/v2/books.json",
  "claimBundles": [
    {
      "id": "legacy-seed",
      "asset": "assets/data/claims_seed.json",
      "priority": 0
    },
    {
      "id": "wealth-inequality-v2",
      "asset": "assets/data/v2/seeds/wealth_inequality.json",
      "priority": 10
    },
    {
      "id": "historical-socialism-v2",
      "asset": "assets/data/v2/seeds/historical_socialism.json",
      "priority": 10
    },
    {
      "id": "nordic-myth-v2",
      "asset": "assets/data/v2/seeds/nordic_myth.json",
      "priority": 10
    },
    {
      "id": "profit-exploitation-v2",
      "asset": "assets/data/v2/seeds/profit_exploitation.json",
      "priority": 10
    },
    {
      "id": "government-intervention-v2",
      "asset": "assets/data/v2/seeds/government_intervention.json",
      "priority": 10
    },
    {
      "id": "human-nature-v2",
      "asset": "assets/data/v2/seeds/human_nature.json",
      "priority": 10
    },
    {
      "id": "founding-principles-v2",
      "asset": "assets/data/v2/seeds/founding_principles.json",
      "priority": 10
    },
    {
      "id": "cultural-subversion-v2",
      "asset": "assets/data/v2/seeds/cultural_subversion.json",
      "priority": 10
    },
    {
      "id": "cultural-subversion-wave2-v3",
      "asset": "assets/data/v2/seeds/cultural_subversion_wave2.json",
      "priority": 10
    },
    {
      "id": "cultural-subversion-wave3-v31",
      "asset": "assets/data/v2/seeds/cultural_subversion_wave3.json",
      "priority": 10
    },
    {
      "id": "contemporary-arguments-v38",
      "asset": "assets/data/v2/seeds/contemporary_arguments.json",
      "priority": 10
    },
    {
      "id": "pd-steelman-wave4-v39",
      "asset": "assets/data/v2/seeds/pd_steelman_wave4.json",
      "priority": 10
    },
    {
      "id": "high-intent-2026-v310",
      "asset": "assets/data/v2/seeds/high_intent_2026.json",
      "priority": 10
    },
    {
      "id": "high-intent-wave2-v311",
      "asset": "assets/data/v2/seeds/high_intent_wave2.json",
      "priority": 10
    },
    {
      "id": "high-intent-wave3-v313",
      "asset": "assets/data/v2/seeds/high_intent_wave3.json",
      "priority": 10
    },
    {
      "id": "high-intent-wave4-v314",
      "asset": "assets/data/v2/seeds/high_intent_wave4.json",
      "priority": 10
    },
    {
      "id": "high-intent-wave5-v315",
      "asset": "assets/data/v2/seeds/high_intent_wave5.json",
      "priority": 10
    },
    {
      "id": "high-intent-wave6-v316",
      "asset": "assets/data/v2/seeds/high_intent_wave6.json",
      "priority": 10
    },
    {
      "id": "high-intent-wave7-v317",
      "asset": "assets/data/v2/seeds/high_intent_wave7.json",
      "priority": 10
    }
  ],
  "contentHash": "sha256:baf3eb52b7ba6f67e9fa59d5935dcbe829a6467d23474fd4f36217d819bc3569"
}
